question;answer_choice_a;answer_choice_b;answer_choice_c
Какое утверждение относительно класса java.lang.Object верно;у этого класса нет полей;нельзя явно переопределять методы этого класса;нельзя явно наследовать этот класс
Какое утверждение относительно класса String верно;является абстрактным;содержит только статические методы;обладает свойством неизменяемости
Какое преимущество предоставляет интерфейс Runnable по сравнению с классом Thread;позволяет более гибко работать с приоритетами потоков;позволяет классу, содержащему логику работы, наследоваться от других классов;позволяет обойтись без класса Thread
Какая кодировка используется классом OutputStreamWriter по умолчанию;UTF-8 независимо от системы, где запущена Java-машина;UTF-16 независимо от системы, где запущена Java-машина;используемая кодировка зависит от системы, где запущена Java-машина
Каким образом на однопроцессорной машине исполняются многопоточные приложения;количество процессоров для многопоточной архитектуры не имеет значения;рабочее время процессора разбивается на небольшие интервалы, в течение которых выполняется одна задача, после чего происходит переключение на следующую задачу;на однопроцессорном компьютере многопоточные приложения не исполняются
